{
  "slug": "influence-functions",
  "name": "Influence Functions",
  "description": "Influence functions quantify how much each training example influenced a model's predictions by computing the change in prediction that would occur if that training example were removed and the model retrained. Using calculus and the implicit function theorem, they approximate this 'leave-one-out' effect without actually retraining the model by computing gradients and Hessian information. This mathematical approach reveals which specific training examples were most responsible for pushing the model toward or away from particular predictions, enabling practitioners to trace problematic outputs back to their root causes in the training data.",
  "assurance_goals": [
    "Explainability",
    "Fairness"
  ],
  "tags": [
    "applicable-models/architecture/linear-models",
    "applicable-models/architecture/neural-networks",
    "applicable-models/paradigm/parametric",
    "applicable-models/paradigm/supervised",
    "applicable-models/requirements/differentiable",
    "applicable-models/requirements/gradient-access",
    "data-requirements/access-to-training-data",
    "applicable-models/requirements/white-box",
    "assurance-goal-category/explainability",
    "assurance-goal-category/explainability/attribution-methods/gradient-based",
    "assurance-goal-category/explainability/explains/causal-pathways",
    "assurance-goal-category/explainability/explains/data-patterns",
    "assurance-goal-category/explainability/instance-based/influence-analysis",
    "assurance-goal-category/explainability/property/causality",
    "assurance-goal-category/explainability/property/fidelity",
    "assurance-goal-category/fairness",
    "assurance-goal-category/fairness/bias-diagnosis",
    "data-type/any",
    "evidence-type/quantitative-metric",
    "expertise-needed/ml-engineering",
    "explanatory-scope/local",
    "technique-type/algorithmic",
    "lifecycle-stage/model-development",
    "lifecycle-stage/model-development/model-testing-and-validation"
  ],
  "example_use_cases": [
    {
      "description": "Investigating why a medical diagnosis model misclassified a patient by identifying which specific training cases most influenced the incorrect prediction, revealing potential mislabelled examples or problematic patterns in the training data.",
      "goal": "Explainability"
    },
    {
      "description": "Analysing a spam detection system that falsely flagged legitimate emails by tracing the prediction back to influential training examples, discovering that certain training emails contained misleading patterns that caused the model to overfit.",
      "goal": "Explainability"
    },
    {
      "description": "Auditing a loan approval model for discriminatory patterns by identifying which training examples most influenced rejections of minority applicants, revealing whether biased historical decisions are driving current unfair outcomes.",
      "goal": "Fairness"
    }
  ],
  "limitations": [
    {
      "description": "Computationally intensive, requiring Hessian matrix computations that become intractable for very large models with millions of parameters."
    },
    {
      "description": "Requires access to the complete training dataset and training process, making it impossible to apply to pre-trained models without access to original training data."
    },
    {
      "description": "Accuracy degrades for highly non-convex models where the linear approximation underlying influence functions breaks down."
    },
    {
      "description": "Results can be sensitive to hyperparameter choices and may not generalise well across different model architectures or training procedures."
    }
  ],
  "resources": [
    {
      "title": "The influence function — pyDVL documentation",
      "url": "https://pydvl.org/stable/influence/",
      "source_type": "documentation",
      "citationKey": "InfluenceFunctionPyDVL",
      "abstract": "None"
    },
    {
      "title": "influence-release (kohpangwei/influence-release)",
      "url": "https://github.com/kohpangwei/influence-release",
      "source_type": "software_package",
      "publication_date": "2026-08-29T16:45:24Z",
      "citationKey": "kohpangweiInfluencereleaseKohpangweiInfluencerelease2026"
    },
    {
      "title": "Kronfluence (pomonam/kronfluence)",
      "url": "https://github.com/pomonam/kronfluence",
      "source_type": "software_package",
      "publication_date": "2026-10-01T19:38:07Z",
      "citationKey": "baeKronfluencePomonamKronfluence2026",
      "abstract": "Influence Functions with (Eigenvalue-corrected) Kronecker-Factored Approximate Curvature"
    },
    {
      "title": "Understanding Black-box Predictions via Influence Functions",
      "url": "https://proceedings.mlr.press/v70/koh17a.html",
      "source_type": "technical_paper",
      "authors": [
        "Pang Wei Koh",
        "Percy Liang"
      ],
      "publication_date": "2017",
      "citationKey": "weikohUnderstandingBlackboxPredictions2017",
      "abstract": "How can we explain the predictions of a black-box model? In this paper, we use influence functions — a classic technique from robust statistics — to trace a model's prediction through the learning algorithm and back to its training data, thereby identifying training points most responsible for a given prediction. To scale up influence functions to modern machine learning settings, we develop a simple, efficient implementation that requires only oracle access to gradients and Hessian-vector products. We show that even on non-convex and non-differentiable models where the theory breaks down, approximations to influence functions can still provide valuable information. On linear models and convolutional neural networks, we demonstrate that influence functions are useful for multiple purposes: understanding model behavior, debugging models, detecting dataset errors, and even creating visually-indistinguishable training-set attacks."
    },
    {
      "title": "Kronfluence CIFAR-10 example",
      "url": "https://github.com/pomonam/kronfluence/blob/main/examples/cifar/README.md",
      "source_type": "tutorial",
      "citationKey": "KronfluenceCIFAR10Example",
      "abstract": "Influence Functions with (Eigenvalue-corrected) Kronecker-Factored Approximate Curvature - pomonam/kronfluence"
    },
    {
      "title": "Explaining Black Box Predictions and Unveiling Data Artifacts through Influence Functions",
      "url": "https://doi.org/10.18653/v1/2020.acl-main.492",
      "source_type": "application_paper",
      "authors": [
        "Xiaochuang Han",
        "Byron C. Wallace",
        "Yulia Tsvetkov"
      ],
      "publication_date": "2020",
      "citationKey": "hanExplainingBlackBox2020",
      "abstract": "Modern deep learning models for NLP are notoriously opaque.This has motivated the development of methods for interpreting such models, e.g., via gradient-based saliency maps or the visualization of attention weights.Such approaches aim to provide explanations for a particular model prediction by highlighting important words in the corresponding input text.While this might be useful for tasks where decisions are explicitly influenced by individual tokens in the input, we suspect that such highlighting is not always suitable for tasks where model decisions should be driven by more complex reasoning.In this work, we investigate the use of influence functions for NLP, providing an alternative approach to interpreting neural text classifiers.Influence functions explain the decisions of a model by identifying influential training examples.Despite the promise of this approach, influence functions have not yet been extensively evaluated in the context of NLP, a gap addressed by this work.We conduct a comparison between influence functions and common word-saliency methods on representative tasks.As suspected, we find that influence functions are particularly useful for natural language inference, a task in which 'saliency maps' may not provide clear interpretation.Furthermore, we develop a new quantitative measure based on influence functions that can reveal artifacts in training data."
    }
  ],
  "complexity_rating": 5,
  "computational_cost_rating": 5,
  "related_techniques": [
    "jackknife-resampling",
    "machine-unlearning",
    "data-poisoning-detection",
    "membership-inference-attack-testing"
  ],
  "sample_claims": [
    {
      "text": "The diagnostic model's predictions are traceable to specific patient cases in the training data",
      "domain": "healthcare",
      "assuranceGoal": "explainability"
    },
    {
      "text": "The credit model's decisions on individual applications are attributable to identifiable historical loan records",
      "domain": "finance",
      "assuranceGoal": "explainability"
    },
    {
      "text": "The welfare eligibility system's rejections can be traced to specific training cases to identify discriminatory patterns",
      "domain": "public sector",
      "assuranceGoal": "fairness"
    },
    {
      "text": "The perception system's object classification decisions are traceable to specific labeled examples from the training corpus",
      "domain": "autonomous systems",
      "assuranceGoal": "explainability"
    }
  ]
}