{
  "slug": "out-of-distribution-detector-for-neural-networks",
  "name": "Out-of-Distribution Detector for Neural Networks",
  "description": "ODIN (Out-of-Distribution Detector for Neural Networks) flags inputs that look unlike the data a neural network classifier was trained on, and it works on an already trained network without retraining it. A classifier reports a confidence score, the highest probability it gives to any class, but that score is often high even for unfamiliar inputs. ODIN adjusts the score in two ways so that familiar and unfamiliar inputs separate better. It divides the classifier's raw output scores by a large constant, called the temperature, before turning them into probabilities, and it nudges the input slightly in the direction that raises the score, which lifts familiar inputs more than unfamiliar ones. An input whose adjusted score falls below a chosen threshold is flagged as out-of-distribution, so its prediction can be withheld or referred for review.",
  "assurance_goals": [
    "Reliability",
    "Safety"
  ],
  "tags": [
    "applicable-models/architecture/neural-networks",
    "applicable-models/paradigm/discriminative",
    "applicable-models/paradigm/supervised",
    "applicable-models/requirements/probabilistic-output",
    "applicable-models/requirements/white-box",
    "assurance-goal-category/reliability",
    "assurance-goal-category/reliability/shift-detection",
    "assurance-goal-category/safety",
    "assurance-goal-category/safety/monitoring",
    "data-requirements/no-special-requirements",
    "data-type/image",
    "evidence-type/quantitative-metric",
    "expertise-needed/ml-engineering",
    "expertise-needed/statistics",
    "lifecycle-stage/model-development",
    "lifecycle-stage/model-development/model-testing-and-validation",
    "lifecycle-stage/system-deployment",
    "technique-type/algorithmic",
    "lifecycle-stage/system-deployment/system-use-and-monitoring"
  ],
  "example_use_cases": [
    {
      "goal": "Reliability",
      "description": "A hospital screens each chest X-ray with ODIN before the diagnostic classifier's result is shown. Scans that are not chest X-rays, or that carry heavy artefacts, are flagged for human review instead of receiving a confident diagnosis, and the false positive rate is measured on a sample of such scans first."
    },
    {
      "goal": "Safety",
      "description": "An automated driving team scores each camera frame with ODIN and passes frames below the threshold to a fallback routine, such as slowing the vehicle and requesting remote assistance. The team measures how many unfamiliar frames, such as sensor faults or unusual scenes, are wrongly accepted before relying on the detector."
    }
  ],
  "limitations": [
    {
      "description": "Temperature and perturbation size are tuned on a validation set that includes out-of-distribution examples, so some representative unfamiliar data is needed before deployment. The paper found settings transferred reasonably between validation sets, but only on image benchmarks."
    },
    {
      "description": "Detection gets harder as unfamiliar inputs resemble the training data. In the original paper, at 95% acceptance of familiar images, the share of unfamiliar natural images wrongly accepted rose from at most about 11% with a 10-class training set to between 19% and 58% with a 100-class one, so performance must be measured on the deployment's own data."
    },
    {
      "description": "Not designed to resist inputs deliberately crafted to look in-distribution, and the original paper does not evaluate adversarial evasion, so it gives no protection against a deliberate attacker."
    },
    {
      "description": "Needs access to the network's gradients to compute the input perturbation, so it cannot be applied to a model that is reachable only through an API."
    },
    {
      "description": "Each input needs at least one extra forward pass and one backward pass before the final scoring pass, which can matter for real-time or high-volume use."
    }
  ],
  "resources": [
    {
      "title": "ODIN - pytorch-ood",
      "url": "https://pytorch-ood.readthedocs.io/en/latest/detectors/odin.html",
      "source_type": "documentation",
      "citationKey": "ODINPytorchood",
      "abstract": "classification no segmentation"
    },
    {
      "title": "odin",
      "url": "https://github.com/facebookresearch/odin",
      "source_type": "software_package",
      "publication_date": "2018-02-10",
      "citationKey": "Odin2018",
      "abstract": "A simple and effective method for detecting out-of-distribution images in neural networks."
    },
    {
      "title": "Enhancing The Reliability of Out-of-distribution Image Detection in Neural Networks",
      "url": "http://arxiv.org/abs/1706.02690v5",
      "source_type": "technical_paper",
      "authors": [
        "Shiyu Liang",
        "Yixuan Li",
        "R. Srikant"
      ],
      "publication_date": "2017-06-08",
      "citationKey": "liangEnhancingReliabilityOutofdistribution2017",
      "abstract": "We consider the problem of detecting out-of-distribution images in neural networks. We propose ODIN, a simple and effective method that does not require any change to a pre-trained neural network. Our method is based on the observation that using temperature scaling and adding small perturbations to the input can separate the softmax score distributions between in- and out-of-distribution images, allowing for more effective detection. We show in a series of experiments that ODIN is compatible with diverse network architectures and datasets. It consistently outperforms the baseline approach by a large margin, establishing a new state-of-the-art performance on this task. For example, ODIN reduces the false positive rate from the baseline 34.7% to 4.3% on the DenseNet (applied to CIFAR-10) when the true positive rate is 95%."
    },
    {
      "title": "ODIN - CIFAR10 - pytorch-ood",
      "url": "https://pytorch-ood.readthedocs.io/en/latest/auto_examples/benchmarks/interface/cifar10_odin.html",
      "source_type": "tutorial",
      "citationKey": "ODINCIFAR10Pytorchood",
      "abstract": "Reproduces the ODIN benchmark for OOD detection, from the paper Enhancing the reliability of out-of-distribution image detection in neural networks. This produces a table with the following output:..."
    },
    {
      "title": "Confidence-Based Out-of-Distribution Detection: A Comparative Study and Analysis",
      "url": "https://doi.org/10.1007/978-3-030-87735-4_12",
      "source_type": "application_paper",
      "authors": [
        "Christoph Berger",
        "Magdalini Paschali",
        "Ben Glocker",
        "Konstantinos Kamnitsas"
      ],
      "publication_date": "2021",
      "citationKey": "bergerConfidenceBasedOutofDistributionDetection2021",
      "abstract": "Image classification models deployed in the real world may receive inputs outside the intended data distribution. For critical applications such as clinical decision making, it is important that a model can detect such out-of-distribution (OOD) inputs and express its uncertainty. In this work, we assess the capability of various state-of-the-art approaches for confidence-based OOD detection through a comparative study and in-depth analysis. First, we leverage a computer vision benchmark to reproduce and compare multiple OOD detection methods. We then evaluate their capabilities on the challenging task of disease classification using chest X-rays. Our study shows that high performance in a computer vision task does not directly translate to accuracy in a medical imaging task. We analyse factors that affect performance of the methods between the two tasks. Our results provide useful insights for developing the next generation of OOD detection methods."
    }
  ],
  "complexity_rating": 4,
  "computational_cost_rating": 3,
  "acronym": "ODIN",
  "related_techniques": [
    "out-of-domain-detection",
    "knowledge-boundary-probing",
    "deep-ensembles",
    "monte-carlo-dropout"
  ],
  "sample_claims": [
    {
      "text": "Camera frames that fall outside the perception network's training distribution, such as those from a sensor fault, are flagged before the planner uses the network's output.",
      "domain": "autonomous systems",
      "assuranceGoal": "safety"
    },
    {
      "text": "Scans that are not of the type the diagnostic classifier was trained on are rejected by the out-of-distribution detector instead of receiving a confident diagnosis.",
      "domain": "healthcare",
      "assuranceGoal": "reliability"
    },
    {
      "text": "The detector's threshold is set so that 95% of in-distribution validation inputs are accepted, and the share of out-of-distribution test inputs wrongly accepted at that threshold is reported.",
      "domain": "general",
      "assuranceGoal": "reliability"
    },
    {
      "text": "Images of unfamiliar part types or from unfamiliar cameras are held for human inspection instead of passing through the automated quality-control classifier.",
      "domain": "manufacturing",
      "assuranceGoal": "safety"
    }
  ]
}